6.1.1.1	tyrosine-tRNA ligase	additional information	-	additional information	kinetic parameters for anticodon mutants of tRNATyr and for for acceptor stem mutants of tRNATyr	Aeropyrum pernix	-	2	727796	
6.1.1.1	tyrosine-tRNA ligase	additional information	-	additional information	kinetics	Escherichia coli	-	2	650300	
6.1.1.1	tyrosine-tRNA ligase	additional information	-	additional information	kinetics	Geobacillus stearothermophilus	-	2	650300	
6.1.1.1	tyrosine-tRNA ligase	additional information	-	additional information	kinetics with Escherichia coli tRNATyr, Plasmodium falciparum tRNATyr, and diverse wild-type and mutant Saccharomyces cerevisiae tRNATyrs, overview	Acanthamoeba polyphaga Mimivirus	Q5UPJ7	2	675706	
6.1.1.1	tyrosine-tRNA ligase	additional information	-	additional information	Michaelis-Menten steady-state kinetics. Steady-state kinetic constants for ATP-[32P]PPi exchange for CHO cytosolic full length wild-type and variant TyrRS	Cricetulus griseus	-	2	745300	
6.1.1.1	tyrosine-tRNA ligase	additional information	-	additional information	Michaelis-Menten steady-state kinetics. Steady-state kinetic constants for ATP-[32P]PPi exchange for CHO cytosolic full length wild-type and variant TyrRS	Cricetulus griseus	G3H935	2	745300	
6.1.1.1	tyrosine-tRNA ligase	additional information	-	additional information	mutants	Acidithiobacillus ferrooxidans	-	2	651278	
6.1.1.1	tyrosine-tRNA ligase	additional information	-	additional information	the C-terminal His-tag of the recombinant enzyme has little effect on the catalytic activity	Homo sapiens	-	2	653754	
6.1.1.1	tyrosine-tRNA ligase	0.000022	-	tRNATyr	chloroplasts	Glycine max	-	1307	52	
6.1.1.1	tyrosine-tRNA ligase	0.000022	-	tRNATyr	in absence of KCl, pH 7.4, 30°C	Escherichia coli	-	1307	650300	
6.1.1.1	tyrosine-tRNA ligase	0.000037	-	tRNATyr	in presence of 50 mM KCl, pH 7.4, 30°C	Escherichia coli	-	1307	650300	
6.1.1.1	tyrosine-tRNA ligase	0.0000898	-	tRNATyr	cytoplasm	Glycine max	-	1307	52	
6.1.1.1	tyrosine-tRNA ligase	0.000093	-	tRNATyr	in presence of 100 mM KCl, pH 7.4, 30°C	Escherichia coli	-	1307	650300	
6.1.1.1	tyrosine-tRNA ligase	0.00022	-	tRNATyr	55°C, pH 8.0; wild type enzyme, at 55°C, in 100 mM HEPES-NaOH (pH 8.0), 10 mM MgCl2, 10 mM KCl	Aeropyrum pernix	-	1307	727796	
6.1.1.1	tyrosine-tRNA ligase	0.00024	-	tRNATyr	in presence of 150 mM KCl, pH 7.4, 30°C	Escherichia coli	-	1307	650300	
6.1.1.1	tyrosine-tRNA ligase	0.0003	-	L-tyrosine	30°C, purified recombinant His-tagged enzyme	Homo sapiens	-	109	653754	
6.1.1.1	tyrosine-tRNA ligase	0.0003	-	tRNATyr	-	Drosophila melanogaster	-	1307	47	
6.1.1.1	tyrosine-tRNA ligase	0.00037	-	tRNATyr	pH 7.2, 37°C, tRNATyr aminoacylation activity, recombinant wild-type enzyme	Escherichia coli	-	1307	744707	
6.1.1.1	tyrosine-tRNA ligase	0.00042	-	tRNATyr	pH 7.2, 37°C, tRNATyr aminoacylation activity, recombinant lysine acetylated enzyme mutant 144AcK	Escherichia coli	-	1307	744707	
6.1.1.1	tyrosine-tRNA ligase	0.00043	-	ATP	pH 7.2, 37°C, Tyr activation activity, recombinant wild-type enzyme	Escherichia coli	-	4	744707	
6.1.1.1	tyrosine-tRNA ligase	0.00045	-	ATP	pH 7.2, 37°C, Tyr activation activity, recombinant lysine acetylated enzyme mutant 144AcK	Escherichia coli	-	4	744707	
6.1.1.1	tyrosine-tRNA ligase	0.00045	-	tRNATyr	pH 7.2, 37°C, tRNATyr aminoacylation activity, recombinant lysine acetylated enzyme mutant 85AcK	Escherichia coli	-	1307	744707	
6.1.1.1	tyrosine-tRNA ligase	0.00048	-	tRNATyr	pH 7.2, 37°C, tRNATyr aminoacylation activity, recombinant lysine acetylated enzyme mutant 355AcK	Escherichia coli	-	1307	744707	
6.1.1.1	tyrosine-tRNA ligase	0.00049	-	ATP	pH 7.2, 37°C, Tyr activation activity, recombinant lysine acetylated enzyme mutant 355AcK	Escherichia coli	-	4	744707	
6.1.1.1	tyrosine-tRNA ligase	0.00052	-	tRNATyr	pH 7.6, 37°C, native Escherichia coli tRNATyr	Homo sapiens	Q9Y2Z4	1307	658121	
6.1.1.1	tyrosine-tRNA ligase	0.00071	-	ATP	pH 7.2, 37°C, Tyr activation activity, recombinant lysine acetylated enzyme mutant 235AcK	Escherichia coli	-	4	744707	
6.1.1.1	tyrosine-tRNA ligase	0.0009	-	tRNATyr	30°C, purified recombinant His-tagged enzyme	Homo sapiens	-	1307	653754	
6.1.1.1	tyrosine-tRNA ligase	0.0014	-	L-tyrosine	mutant M55L, pH 7.8, 25°C	Geobacillus stearothermophilus	-	109	651887	
6.1.1.1	tyrosine-tRNA ligase	0.0015	-	tRNYTyr	-	Triticum aestivum	-	46543	23	
6.1.1.1	tyrosine-tRNA ligase	0.0018	-	L-tyrosine	mutant I52L, pH 7.8, 25°C	Geobacillus stearothermophilus	-	109	651887	
6.1.1.1	tyrosine-tRNA ligase	0.002	-	tyrosine	-	Drosophila melanogaster	-	709	47	
6.1.1.1	tyrosine-tRNA ligase	0.0021	-	L-tyrosine	wild-type enzyme and mutant L105V, pH 7.8, 25°C	Geobacillus stearothermophilus	-	109	651887	
6.1.1.1	tyrosine-tRNA ligase	0.00223	-	ATP	pH 7.2, 37°C, Tyr activation activity, recombinant lysine acetylated enzyme mutant 85AcK	Escherichia coli	-	4	744707	
6.1.1.1	tyrosine-tRNA ligase	0.0025	-	tRNATyr	aminoacylation reaction, pH 8.0, wild-type enzyme	Acidithiobacillus ferrooxidans	-	1307	651278	
6.1.1.1	tyrosine-tRNA ligase	0.0033	-	tyrosine	-	Triticum aestivum	-	709	23	
6.1.1.1	tyrosine-tRNA ligase	0.0048	-	tRNATyr	pH 7.6, 37°C, human mitochondrial tRNATyr	Homo sapiens	Q9Y2Z4	1307	658121	
6.1.1.1	tyrosine-tRNA ligase	0.0049	-	L-tyrosine	chloroplasts	Glycine max	-	109	52	
6.1.1.1	tyrosine-tRNA ligase	0.00669	-	L-tyrosine	pH 7.2, 37°C, Tyr activation activity, recombinant lysine acetylated enzyme mutant 355AcK	Escherichia coli	-	109	744707	
6.1.1.1	tyrosine-tRNA ligase	0.00678	-	L-tyrosine	pH 7.2, 37°C, Tyr activation activity, recombinant lysine acetylated enzyme mutant 85AcK	Escherichia coli	-	109	744707	
6.1.1.1	tyrosine-tRNA ligase	0.0068	-	L-tyrosine	cytoplasm	Glycine max	-	109	52	
6.1.1.1	tyrosine-tRNA ligase	0.00713	-	L-tyrosine	pH 7.2, 37°C, Tyr activation activity, recombinant wild-type enzyme	Escherichia coli	-	109	744707	
6.1.1.1	tyrosine-tRNA ligase	0.00728	-	L-tyrosine	pH 7.2, 37°C, Tyr activation activity, recombinant lysine acetylated enzyme mutant 144AcK	Escherichia coli	-	109	744707	
6.1.1.1	tyrosine-tRNA ligase	0.00845	-	L-tyrosine	pH 7.2, 37°C, Tyr activation activity, recombinant lysine acetylated enzyme mutant 235AcK	Escherichia coli	-	109	744707	
6.1.1.1	tyrosine-tRNA ligase	0.021	-	L-tyrosine	phosphate exchange reaction, pH 8.0, wild-type enzyme	Acidithiobacillus ferrooxidans	-	109	651278	
6.1.1.1	tyrosine-tRNA ligase	0.027	-	L-tyrosine	aminoacylation reaction, pH 8.0, wild-type enzyme	Acidithiobacillus ferrooxidans	-	109	651278	
6.1.1.1	tyrosine-tRNA ligase	0.04	-	ATP	-	Triticum aestivum	-	4	23	
6.1.1.1	tyrosine-tRNA ligase	0.049	-	ATP	cytoplasm	Glycine max	-	4	52	
6.1.1.1	tyrosine-tRNA ligase	0.07	-	ATP	phosphate exchange reaction, pH 8.0, wild-type enzyme	Acidithiobacillus ferrooxidans	-	4	651278	
6.1.1.1	tyrosine-tRNA ligase	0.13	-	ATP	aminoacylation reaction, pH 8.0, wild-type enzyme	Acidithiobacillus ferrooxidans	-	4	651278	
6.1.1.1	tyrosine-tRNA ligase	0.146	-	L-tyrosine	recombinant wild-type enzyme, pH 7.8, 25°C	Cricetulus griseus	-	109	745300	
6.1.1.1	tyrosine-tRNA ligase	0.146	-	L-tyrosine	recombinant wild-type enzyme, pH 7.8, 25°C	Cricetulus griseus	G3H935	109	745300	
6.1.1.1	tyrosine-tRNA ligase	0.16	-	L-tyrosine	recombinant truncated mutant enzyme, pH 7.8, 25°C	Cricetulus griseus	-	109	745300	
6.1.1.1	tyrosine-tRNA ligase	0.16	-	L-tyrosine	recombinant truncated mutant enzyme, pH 7.8, 25°C	Cricetulus griseus	G3H935	109	745300	
6.1.1.1	tyrosine-tRNA ligase	0.21	-	ATP	chloroplasts	Glycine max	-	4	52	
6.1.1.1	tyrosine-tRNA ligase	2	-	ATP	mutant M55L, pH 7.8, 25°C	Geobacillus stearothermophilus	-	4	651887	
6.1.1.1	tyrosine-tRNA ligase	2.1	-	ATP	wild-type enzyme, pH 7.8, 25°C	Geobacillus stearothermophilus	-	4	651887	
6.1.1.1	tyrosine-tRNA ligase	2.4	-	ATP	mutant I52L, pH 7.8, 25°C	Geobacillus stearothermophilus	-	4	651887	
6.1.1.1	tyrosine-tRNA ligase	2.7	-	ATP	mutant L105V, pH 7.8, 25°C	Geobacillus stearothermophilus	-	4	651887	
6.1.1.1	tyrosine-tRNA ligase	7	-	ATP	-	Drosophila melanogaster	-	4	47	
6.1.1.10	methionine-tRNA ligase	additional information	-	additional information	kinetics with Escherichia coli native tRNAMet and initiator tRNAMet, and Saccharomyces cerevisiae native tRNAMet and initiator tRNAMet, overview	Acanthamoeba polyphaga Mimivirus	-	2	675706	
6.1.1.10	methionine-tRNA ligase	additional information	-	additional information	Km-values of mutant enzymes in aminoacylation	Escherichia coli	-	2	29	
6.1.1.10	methionine-tRNA ligase	additional information	-	additional information	Km-values of mutant enzymes in ATP-diphosphate exchange reaction	Escherichia coli	-	2	28	
6.1.1.10	methionine-tRNA ligase	0.00015	-	tRNAMet	pH 8.2, 37°C, mitochondrial tRNAMet from Bos taurus, recombinant enzyme	Homo sapiens	P56192	622	661156	
6.1.1.10	methionine-tRNA ligase	0.00016	-	tRNAMet	pH 8.2, 37°C, human mitochondrial wild-type tRNAMet, recombinant enzyme	Homo sapiens	P56192	622	661156	
6.1.1.10	methionine-tRNA ligase	0.00025	-	tRNAMet	-	Lupinus sp.	-	622	63	
6.1.1.10	methionine-tRNA ligase	0.0004	-	tRNAMet	recombinant mitochondrial isozyme as GST-fusion protein, pH 7.8, 25°C	Saccharomyces cerevisiae	-	622	652862	
6.1.1.10	methionine-tRNA ligase	0.00055	-	tRNAMet	wild-type, second step of reaction, tRNA aminoacylation	Clostridioides difficile	-	622	704223	
6.1.1.10	methionine-tRNA ligase	0.00064	-	tRNAMet	mutant G54S/L203S, second step of reaction, tRNA aminoacylation	Clostridioides difficile	-	622	704223	
6.1.1.10	methionine-tRNA ligase	0.00065	-	tRNAMet	mutant D229E, second step of reaction, tRNA aminoacylation	Clostridioides difficile	-	622	704223	
6.1.1.10	methionine-tRNA ligase	0.00066	-	tRNAMet	in vitro synthesized tRNAMet from Saccharomyces cerevisiae, pH 7.5, 25°C, wild-type enzyme	Oryza sativa	-	622	650978	
6.1.1.10	methionine-tRNA ligase	0.00066	-	tRNAMet	in vitro synthesized tRNAMet from Saccharomyces cerevisiae, pH 7.5, 25°C, wild-type enzyme	Oryza sativa	Q9ZTS1	622	650978	
6.1.1.10	methionine-tRNA ligase	0.0007	-	tRNA fraction from Saccharomyces cerevisiae	pH 7.5, 25°C, wild-type enzyme	Oryza sativa	-	11457	650978	
6.1.1.10	methionine-tRNA ligase	0.0007	-	tRNA fraction from Saccharomyces cerevisiae	pH 7.5, 25°C, wild-type enzyme	Oryza sativa	Q9ZTS1	11457	650978	
6.1.1.10	methionine-tRNA ligase	0.00075	-	tRNA fraction from Saccharomyces cerevisiae	pH 7.5, 25°C, truncated mutant	Oryza sativa	-	11457	650978	
6.1.1.10	methionine-tRNA ligase	0.00075	-	tRNA fraction from Saccharomyces cerevisiae	pH 7.5, 25°C, truncated mutant	Oryza sativa	Q9ZTS1	11457	650978	
6.1.1.10	methionine-tRNA ligase	0.0008	-	tRNAMet	mutant V216A, second step of reaction, tRNA aminoacylation	Clostridioides difficile	-	622	704223	
6.1.1.10	methionine-tRNA ligase	0.0009	-	tRNAMet	wild-type enzyme	Escherichia coli	-	622	29	
6.1.1.10	methionine-tRNA ligase	0.00096	-	tRNAMet	mutant V216F/L203S, second step of reaction, tRNA aminoacylation	Clostridioides difficile	-	622	704223	
6.1.1.10	methionine-tRNA ligase	0.001	-	tRNAMet	-	Saccharomyces cerevisiae	-	622	70	
6.1.1.10	methionine-tRNA ligase	0.00102	-	tRNAMet	mutant G54S, second step of reaction, tRNA aminoacylation	Clostridioides difficile	-	622	704223	
6.1.1.10	methionine-tRNA ligase	0.00121	-	tRNAMet	mutant I57N/H101N, second step of reaction, tRNA aminoacylation	Clostridioides difficile	-	622	704223	
6.1.1.10	methionine-tRNA ligase	0.0021	-	tRNAMet	pH 8.2, 37°C, initiator tRNA from Escherichia coli, recombinant enzyme	Homo sapiens	P56192	622	661156	
6.1.1.10	methionine-tRNA ligase	0.0026	-	tRNAMet	mutant I57N, second step of reaction, tRNA aminoacylation	Clostridioides difficile	-	622	704223	
6.1.1.10	methionine-tRNA ligase	0.0032	-	tRNAMet	substrate from Escherichia coli, 37°C	Mycobacterium tuberculosis	-	622	651240	
6.1.1.10	methionine-tRNA ligase	0.005	-	Met	-	Saccharomyces cerevisiae	-	678	70	
6.1.1.10	methionine-tRNA ligase	0.006	-	L-methionine	mutant I57N, first step of reaction, methionyl-adenylate formation	Clostridioides difficile	-	88	704223	
6.1.1.10	methionine-tRNA ligase	0.0065	-	tRNAMet	in vitro synthesized tRNAMet from Saccharomyces cerevisiae, pH 7.5, 25°C, truncated mutant	Oryza sativa	-	622	650978	
6.1.1.10	methionine-tRNA ligase	0.0065	-	tRNAMet	in vitro synthesized tRNAMet from Saccharomyces cerevisiae, pH 7.5, 25°C, truncated mutant	Oryza sativa	Q9ZTS1	622	650978	
6.1.1.10	methionine-tRNA ligase	0.009	-	tRNAMet	recombinant cytoplasmic isozyme, pH 7.8, 25°C	Saccharomyces cerevisiae	-	622	652862	
6.1.1.10	methionine-tRNA ligase	0.015	-	Met	-	Lupinus sp.	-	678	63	
6.1.1.10	methionine-tRNA ligase	0.015	-	tRNAMet	recombinant cytoplasmic isozyme as GST-fusion protein, pH 7.8, 25°C	Saccharomyces cerevisiae	-	622	652862	
6.1.1.10	methionine-tRNA ligase	0.017	-	L-methionine	mutant V216A, first step of reaction, methionyl-adenylate formation	Clostridioides difficile	-	88	704223	
6.1.1.10	methionine-tRNA ligase	0.018	-	L-methionine	pH 8.2, 37°C, recombinant enzyme	Homo sapiens	P56192	88	661156	
6.1.1.10	methionine-tRNA ligase	0.02	-	Met	strain 547, ATP-diphosphate exchange	Escherichia coli	-	678	28	
6.1.1.10	methionine-tRNA ligase	0.025	-	L-methionine	mutant V216F/L203S, first step of reaction, methionyl-adenylate formation; wild-type, first step of reaction, methionyl-adenylate formation	Clostridioides difficile	-	88	704223	
6.1.1.10	methionine-tRNA ligase	0.032	-	Met	methionine-dependent ATP-diphosphate exchange	Vigna radiata var. radiata	-	678	64	
6.1.1.10	methionine-tRNA ligase	0.037	-	ATP	at pH 8.0 and 25°C	Leishmania donovani	-	4	743928	
6.1.1.10	methionine-tRNA ligase	0.038	-	selenomethionine	selenomethionine-dependent ATP-diphosphate exchange	Vigna radiata var. radiata	-	9267	64	
6.1.1.10	methionine-tRNA ligase	0.055	-	L-methionine	mutant G54S/L203S, first step of reaction, methionyl-adenylate formation	Clostridioides difficile	-	88	704223	
6.1.1.10	methionine-tRNA ligase	0.078	-	Met	wild-type enzyme	Escherichia coli	-	678	54	
6.1.1.10	methionine-tRNA ligase	0.085	-	ATP	pH 8.2, 37°C, recombinant enzyme	Homo sapiens	P56192	4	661156	
6.1.1.10	methionine-tRNA ligase	0.09	-	ATP	-	Lupinus sp.	-	4	63	
6.1.1.10	methionine-tRNA ligase	0.092	-	L-methionine	mutant D229E, first step of reaction, methionyl-adenylate formation	Clostridioides difficile	-	88	704223	
6.1.1.10	methionine-tRNA ligase	0.133	-	L-Met	ATP-diphosphate exchange, enzyme form B	Mycolicibacterium smegmatis	-	468	57	
6.1.1.10	methionine-tRNA ligase	0.16	-	L-methionine	mutant G54S, first step of reaction, methionyl-adenylate formation	Clostridioides difficile	-	88	704223	
6.1.1.10	methionine-tRNA ligase	0.166	-	L-Met	ATP-diphosphate exchange, enzyme form A	Mycolicibacterium smegmatis	-	468	57	
6.1.1.10	methionine-tRNA ligase	0.173	-	L-methionine	at pH 8.0 and 25°C	Leishmania donovani	-	88	743928	
6.1.1.10	methionine-tRNA ligase	0.19	-	L-methionine	mutant I57N/H101N, first step of reaction, methionyl-adenylate formation	Clostridioides difficile	-	88	704223	
6.1.1.10	methionine-tRNA ligase	0.26	-	L-Met	-	Paracoccus denitrificans	-	468	58	
6.1.1.10	methionine-tRNA ligase	0.31	-	selenomethionine	-	Paracoccus denitrificans	-	9267	58	
6.1.1.10	methionine-tRNA ligase	0.375	-	ATP	wild-type, first step of reaction, methionyl-adenylate formation	Clostridioides difficile	-	4	704223	
6.1.1.10	methionine-tRNA ligase	0.383	-	norleucine	-	Paracoccus denitrificans	-	7259	58	
6.1.1.10	methionine-tRNA ligase	0.41	-	ATP	strain 547, ATP-diphosphate exchange	Escherichia coli	-	4	28	
6.1.1.10	methionine-tRNA ligase	0.44	-	ATP	mutant G54S, first step of reaction, methionyl-adenylate formation	Clostridioides difficile	-	4	704223	
6.1.1.10	methionine-tRNA ligase	0.475	-	ATP	mutant H101N/G213C, first step of reaction, methionyl-adenylate formation	Clostridioides difficile	-	4	704223	
6.1.1.10	methionine-tRNA ligase	0.48	1.63	Met	Km-values of various mutant strains	Escherichia coli	-	678	54	
6.1.1.10	methionine-tRNA ligase	0.7	-	ATP	mutant H101D, first step of reaction, methionyl-adenylate formation	Clostridioides difficile	-	4	704223	
6.1.1.10	methionine-tRNA ligase	0.78	-	ATP	mutant V216A, first step of reaction, methionyl-adenylate formation	Clostridioides difficile	-	4	704223	
6.1.1.10	methionine-tRNA ligase	0.85	-	ATP	mutant V216F/L203S, first step of reaction, methionyl-adenylate formation	Clostridioides difficile	-	4	704223	
6.1.1.10	methionine-tRNA ligase	0.87	-	ATP	-	Paracoccus denitrificans	-	4	58	
6.1.1.10	methionine-tRNA ligase	0.98	-	ATP	mutant D229E, first step of reaction, methionyl-adenylate formation	Clostridioides difficile	-	4	704223	
6.1.1.10	methionine-tRNA ligase	1	-	ATP	mutant I57N, first step of reaction, methionyl-adenylate formation	Clostridioides difficile	-	4	704223	
6.1.1.10	methionine-tRNA ligase	1	-	tRNAMet	recombinant C-terminally truncated enzyme, 37°C	Escherichia coli	-	622	651240	
6.1.1.10	methionine-tRNA ligase	1.2	-	CoA	methionylation reaction, cytoplasmic isozyme, pH 7.8, 25°C	Saccharomyces cerevisiae	-	18	652862	
6.1.1.10	methionine-tRNA ligase	1.3	-	ATP	ATP-diphosphate exchange	Vigna radiata var. radiata	-	4	64	
6.1.1.10	methionine-tRNA ligase	1.35	-	ATP	mutant G54S/L203S, first step of reaction, methionyl-adenylate formation	Clostridioides difficile	-	4	704223	
6.1.1.10	methionine-tRNA ligase	1.55	-	L-methionine	mutant H101N/G213C, first step of reaction, methionyl-adenylate formation	Clostridioides difficile	-	88	704223	
6.1.1.10	methionine-tRNA ligase	1.75	-	ATP	mutant I57N/H101N, first step of reaction, methionyl-adenylate formation	Clostridioides difficile	-	4	704223	
6.1.1.10	methionine-tRNA ligase	1.8	-	L-homocysteine	editing reaction, mitochondrial isozyme, pH 7.8, 25°C	Saccharomyces cerevisiae	-	305	652862	
6.1.1.10	methionine-tRNA ligase	3.1	-	L-homocysteine	editing reaction, cytoplasmic isozyme, pH 7.8, 25°C	Saccharomyces cerevisiae	-	305	652862	
6.1.1.10	methionine-tRNA ligase	6.3	-	CoA	methionylation reaction, mitochondrial isozyme, pH 7.8, 25°C	Saccharomyces cerevisiae	-	18	652862	
6.1.1.10	methionine-tRNA ligase	14.8	-	L-methionine	mutant H101D, first step of reaction, methionyl-adenylate formation	Clostridioides difficile	-	88	704223	
6.1.1.10	methionine-tRNA ligase	28.6	-	norleucine	-	Paracoccus denitrificans	-	7259	58	
6.1.1.11	serine-tRNA ligase	additional information	-	additional information	a temperature-dependent inhibition by conformational change of the enzyme (50°C-70°C) lowers both the catalytic activity and the substrate affinity of the ATP and amino acid sites as indicated by a sharp rise in Km with temperature	Geobacillus stearothermophilus	-	2	91	
6.1.1.11	serine-tRNA ligase	additional information	-	additional information	addition of MtArgRS to MtSerRS leads to an almost 4fold increase in the catalytic efficiency of serine attachment to tRNA, also under conditions of elevated temperature and osmolarity, but has no effect on the activity of MtArgRS, steady-state kinetic analyses, overview	Methanothermobacter thermautotrophicus	-	2	715636	
6.1.1.11	serine-tRNA ligase	additional information	-	additional information	kinetic changes in presence of several tRNAs, nonchargeable and heterologous ones, in the ATP-diphosphate exchange assay	Saccharomyces cerevisiae	-	2	651138	
6.1.1.11	serine-tRNA ligase	additional information	-	additional information	kinetics	Streptomyces viridifaciens	-	2	674636	
6.1.1.11	serine-tRNA ligase	additional information	-	additional information	kinetics	Streptomyces viridifaciens	Q84F26	2	674636	
6.1.1.11	serine-tRNA ligase	additional information	-	additional information	kinetics	Trypanosoma brucei	-	2	674720	
6.1.1.11	serine-tRNA ligase	additional information	-	additional information	Km-values for different tRNASer variants	Methanosarcina barkeri	-	2	662297	
6.1.1.11	serine-tRNA ligase	0.00005	-	tRNASer	aminoacylation, truncated enzyme	Saccharomyces cerevisiae	-	887	75	
6.1.1.11	serine-tRNA ligase	0.000068	-	ATP	seryl-AMP formation, wild-type enzyme	Escherichia coli	-	4	76	
6.1.1.11	serine-tRNA ligase	0.00011	-	tRNASer	aminoacylation, wild-type enzyme	Saccharomyces cerevisiae	-	887	74	
6.1.1.11	serine-tRNA ligase	0.00019	-	tRNASer	aminoacylation, wild-type enzyme	Saccharomyces cerevisiae	-	887	75	
6.1.1.11	serine-tRNA ligase	0.00025	-	mitochondrial tRNASer from maize	mitochondrial isozyme, pH 7.5, 30°C	Zea mays	-	22912	649451	
6.1.1.11	serine-tRNA ligase	0.00025	-	tRNASer	substrate from Bombyx mori	Bombyx mori	-	887	97	
6.1.1.11	serine-tRNA ligase	0.00026	-	tRNASer	substrate from rabbit liver	Bombyx mori	-	887	97	
6.1.1.11	serine-tRNA ligase	0.00034	-	Ser	seryl-AMP formation, wild-type enzyme	Escherichia coli	-	870	76	
6.1.1.11	serine-tRNA ligase	0.0004	-	mitochondrial tRNASer from yeast subtype 2	mitochondrial isozyme, pH 7.5, 30°C	Zea mays	-	22913	649451	
6.1.1.11	serine-tRNA ligase	0.0004	-	tRNASecUCA	pH 7.6, 37°C, recombinant enzyme	Trypanosoma brucei	-	62920	674720	
6.1.1.11	serine-tRNA ligase	0.0005	-	tRNASer	-	Lupinus luteus	-	887	85	
6.1.1.11	serine-tRNA ligase	0.0005	-	tRNASer from Escherichia coli	mitochondrial isozyme, pH 7.5, 30°C	Zea mays	-	22914	649451	
6.1.1.11	serine-tRNA ligase	0.00054	-	tRNASer	pH 7.6, 37°C	Homo sapiens	-	887	651241	
6.1.1.11	serine-tRNA ligase	0.00056	-	tRNASer	aminoacylation, wild-type enzyme	Escherichia coli	-	887	76	
6.1.1.11	serine-tRNA ligase	0.00058	-	tRNASer	wild-type, using maize tRNA	Zea mays	-	887	690614	
6.1.1.11	serine-tRNA ligase	0.00065	-	tRNASer	mutant ZmcSerRSDELTAC12 (deletion of 12 C-terminal residues), using maize tRNA	Zea mays	-	887	690614	
6.1.1.11	serine-tRNA ligase	0.00066	-	tRNASer	mutant ZmcSerRSDELTAC18 (deletion of 18 C-terminal residues), using maize tRNA	Zea mays	-	887	690614	
6.1.1.11	serine-tRNA ligase	0.00067	-	chloroplastic tRNASer from maize	mitochondrial isozyme, pH 7.5, 30°C	Zea mays	-	22915	649451	
6.1.1.11	serine-tRNA ligase	0.000759	-	tRNASer (Escherichia coli)	at pH 7.5 and 30°C	Arabidopsis thaliana	-	224777	745626	
6.1.1.11	serine-tRNA ligase	0.000937	-	tRNASer (Saccharomyces cerevisiae)	at pH 7.5 and 30°C	Arabidopsis thaliana	-	224776	745626	
6.1.1.11	serine-tRNA ligase	0.0011	-	tRNASer mutant without anticodon arm	pH 7.6, 37°C	Homo sapiens	-	22910	651241	
6.1.1.11	serine-tRNA ligase	0.0013	-	ATP	ATP-diphosphate exchange assay, wild-type enzyme, pH 7.2, 30°C, in presence of tRNASer	Saccharomyces cerevisiae	-	4	651138	
6.1.1.11	serine-tRNA ligase	0.0013	-	tRNASer(GCU)	pH 7.2, 37°C, bacterial type SerRS	Methanosarcina barkeri	-	13816	662297	
6.1.1.11	serine-tRNA ligase	0.002	-	tRNASer	pH 7.5, 50°C, recombinant MtSerRS in presence of recombinant MtArgRS	Methanothermobacter thermautotrophicus	-	887	715636	
6.1.1.11	serine-tRNA ligase	0.0024	-	tRNASer	mutant K164A	Methanosarcina barkeri	-	887	704464	
6.1.1.11	serine-tRNA ligase	0.0026	-	tRNASer	wild-type	Methanosarcina barkeri	-	887	704464	
6.1.1.11	serine-tRNA ligase	0.0026	-	tRNASer(GGA)	pH 7.2, 37°C, bacterial type SerRS	Methanosarcina barkeri	-	13815	662297	
6.1.1.11	serine-tRNA ligase	0.0029	-	tRNASer(CGA)	pH 7.2, 37°C, bacterial type SerRS	Methanosarcina barkeri	-	13814	662297	
6.1.1.11	serine-tRNA ligase	0.003	-	tRNASer(CGA)	pH 7.2, 37°C, methanogenic SerRS	Methanosarcina barkeri	-	13814	662297	
6.1.1.11	serine-tRNA ligase	0.0032	-	tRNASerCGA	pH 7.6, 37°C, recombinant enzyme	Trypanosoma brucei	-	62919	674720	
6.1.1.11	serine-tRNA ligase	0.0033	-	tRNASec	pH 7.6, 37°C	Homo sapiens	-	17535	651241	
6.1.1.11	serine-tRNA ligase	0.004	-	ATP	ATP-diphosphate exchange	Saccharomyces cerevisiae	-	4	74	
6.1.1.11	serine-tRNA ligase	0.004	-	tRNASec mutant without anticodon arm	pH 7.6, 37°C	Homo sapiens	-	22911	651241	
6.1.1.11	serine-tRNA ligase	0.0042	-	tRNASer	mutant E273A	Methanosarcina barkeri	-	887	704464	
6.1.1.11	serine-tRNA ligase	0.0047	-	tRNASer	mutant E273A/D277A/K280A	Methanosarcina barkeri	-	887	704464	
6.1.1.11	serine-tRNA ligase	0.0047	-	tRNASer(GGA)	pH 7.2, 37°C, methanogenic SerRS	Methanosarcina barkeri	-	13815	662297	
6.1.1.11	serine-tRNA ligase	0.0053	-	tRNASer(GCU)	pH 7.2, 37°C, methanogenic SerRS	Methanosarcina barkeri	-	13816	662297	
6.1.1.11	serine-tRNA ligase	0.00561	-	tRNASer	pH 7.5, 50°C, recombinant MtSerRS	Methanothermobacter thermautotrophicus	-	887	715636	
6.1.1.11	serine-tRNA ligase	0.0086	-	tRNASer	37°C, aminoacylation	Streptomyces sp.	D0UD38	887	701741	
6.1.1.11	serine-tRNA ligase	0.0086	-	tRNASer	37°C, aminoacylation	Streptomyces sp.	D0UD39	887	701741	
6.1.1.11	serine-tRNA ligase	0.01	0.048	ATP	ATP-diphosphate exchange, mutant enzymes	Saccharomyces cerevisiae	-	4	74	
6.1.1.11	serine-tRNA ligase	0.012	-	Ser	-	Lupinus luteus	-	870	85	
6.1.1.11	serine-tRNA ligase	0.012	-	tRNASer	30°C, aminoacylation	Streptomyces sp.	D0UD38	887	701741	
6.1.1.11	serine-tRNA ligase	0.012	-	tRNASer	30°C, aminoacylation	Streptomyces sp.	D0UD39	887	701741	
6.1.1.11	serine-tRNA ligase	0.0143	-	ATP	aminoacylation, truncated enzyme	Saccharomyces cerevisiae	-	4	75	
6.1.1.11	serine-tRNA ligase	0.0146	-	tRNASer	mutant R147A	Methanosarcina barkeri	-	887	704464	
6.1.1.11	serine-tRNA ligase	0.021	-	ATP	aminoacylation, wild-type enzyme	Saccharomyces cerevisiae	-	4	75	
6.1.1.11	serine-tRNA ligase	0.025	-	ATP	aminoacylation, wild-type enzyme	Saccharomyces cerevisiae	-	4	74	
6.1.1.11	serine-tRNA ligase	0.03	-	L-Ser	pH 8.8	Escherichia coli	-	262	81	
6.1.1.11	serine-tRNA ligase	0.04	-	ATP	-	Lupinus luteus	-	4	85	
6.1.1.11	serine-tRNA ligase	0.04	-	L-serine	mitochondrial isozyme, aminoacylation reaction, pH 7.5, 30°C	Zea mays	-	95	649451	
6.1.1.11	serine-tRNA ligase	0.06	0.55	ATP	aminoacylation, mutant enzymes	Saccharomyces cerevisiae	-	4	74	
6.1.1.11	serine-tRNA ligase	0.0625	-	Ser	aminoacylation, wild-type enzyme	Saccharomyces cerevisiae	-	870	75	
6.1.1.11	serine-tRNA ligase	0.063	-	Ser	aminoacylation, wild-type enzyme	Saccharomyces cerevisiae	-	870	74	
6.1.1.11	serine-tRNA ligase	0.065	-	dATP	-	Lupinus luteus	-	140	85	
6.1.1.11	serine-tRNA ligase	0.07	-	L-Ser	acylation	Escherichia coli	-	262	81	
